employer,job_title,job_year_begin,job_year_end,reason_end,full_name,birthdate,deathdate,birthplace,birthyear,deathyear,nth_job,bachelors_year,masters_year,phd_year,bachelors_age,masters_age,phd_age
Lake Erie College,Professor of Mathematics and Physics,1936,1943,Granted leave of absence,Ruth Margaret Peters,"December 11, 1906","May 12, 1961","Gettysburg, Pennsylvania",1906,1961.0,5,1928.0,1931.0,1933.0,22.0,25.0,27.0
Columbia University,Research Mathematician,1943,1943,Moved to MIT,Ruth Margaret Peters,"December 11, 1906","May 12, 1961","Gettysburg, Pennsylvania",1906,1961.0,6,1928.0,1931.0,1933.0,22.0,25.0,27.0
Massachusetts Institute of Technology,Technical Aide,1943,1945,Returned to Lake Erie College,Ruth Margaret Peters,"December 11, 1906","May 12, 1961","Gettysburg, Pennsylvania",1906,1961.0,7,1928.0,1931.0,1933.0,22.0,25.0,27.0
Lake Erie College,Professor of Mathematics and Physics,1945,1947,Moved to St. Lawrence University,Ruth Margaret Peters,"December 11, 1906","May 12, 1961","Gettysburg, Pennsylvania",1906,1961.0,8,1928.0,1931.0,1933.0,22.0,25.0,27.0
St. Lawrence University,Associate Professor,1947,1955,Promoted to Professor,Ruth Margaret Peters,"December 11, 1906","May 12, 1961","Gettysburg, Pennsylvania",1906,1961.0,9,1928.0,1931.0,1933.0,22.0,25.0,27.0
St. Lawrence University,Professor,1955,1958,Moved to University of New Hampshire,Ruth Margaret Peters,"December 11, 1906","May 12, 1961","Gettysburg, Pennsylvania",1906,1961.0,10,1928.0,1931.0,1933.0,22.0,25.0,27.0
University of New Hampshire,Associate Professor,1958,1960,Medical leave,Ruth Margaret Peters,"December 11, 1906","May 12, 1961","Gettysburg, Pennsylvania",1906,1961.0,11,1928.0,1931.0,1933.0,22.0,25.0,27.0
Stoughton Public High School,Teacher,1894,1895,,Roxana Hayward Vivian,"December 9, 1871","May 31, 1961","Hyde Park, Massachusetts",1871,1961.0,1,1894.0,,1901.0,23.0,,30.0
Walnut Hill School,Teacher of Greek and Mathematics,1896,1898,,Roxana Hayward Vivian,"December 9, 1871","May 31, 1961","Hyde Park, Massachusetts",1871,1961.0,2,1894.0,,1901.0,23.0,,30.0
University of Pennsylvania,Alumnae Fellow,1898,1901,,Roxana Hayward Vivian,"December 9, 1871","May 31, 1961","Hyde Park, Massachusetts",1871,1961.0,3,1894.0,,1901.0,23.0,,30.0
Wellesley College,Instructor,1901,1906,Leave of absence,Roxana Hayward Vivian,"December 9, 1871","May 31, 1961","Hyde Park, Massachusetts",1871,1961.0,4,1894.0,,1901.0,23.0,,30.0
American College for Girls,Teacher and Acting President,1906,1909,Return to Wellesley,Roxana Hayward Vivian,"December 9, 1871","May 31, 1961","Hyde Park, Massachusetts",1871,1961.0,5,1894.0,,1901.0,23.0,,30.0
Wellesley College,Associate Professor,1909,1918,Promotion,Roxana Hayward Vivian,"December 9, 1871","May 31, 1961","Hyde Park, Massachusetts",1871,1961.0,6,1894.0,,1901.0,23.0,,30.0
Wellesley College,Professor and Director of Hygiene and Physical Education,1918,1921,Return to Mathematics Department,Roxana Hayward Vivian,"December 9, 1871","May 31, 1961","Hyde Park, Massachusetts",1871,1961.0,7,1894.0,,1901.0,23.0,,30.0
Wellesley College,Professor,1921,1927,Left Wellesley,Roxana Hayward Vivian,"December 9, 1871","May 31, 1961","Hyde Park, Massachusetts",1871,1961.0,8,1894.0,,1901.0,23.0,,30.0
Eagle Wing School,Principal,1928,1928,School did not open,Roxana Hayward Vivian,"December 9, 1871","May 31, 1961","Hyde Park, Massachusetts",1871,1961.0,9,1894.0,,1901.0,23.0,,30.0
Oak Grove Seminary,Mathematics Teacher,1928,1929,Accepted new position,Roxana Hayward Vivian,"December 9, 1871","May 31, 1961","Hyde Park, Massachusetts",1871,1961.0,10,1894.0,,1901.0,23.0,,30.0
Hartwick College,Professor and Dean of Women,1929,1931,Resigned,Roxana Hayward Vivian,"December 9, 1871","May 31, 1961","Hyde Park, Massachusetts",1871,1961.0,11,1894.0,,1901.0,23.0,,30.0
Rye Public High School,Instructor and Dean of Girls,1931,1935,No professional opening found after 1935,Roxana Hayward Vivian,"December 9, 1871","May 31, 1961","Hyde Park, Massachusetts",1871,1961.0,12,1894.0,,1901.0,23.0,,30.0
Mount St. Scholastica College,Instructor,1934,1937,Promotion,Sister M. Helen Sullivan,"April 10, 1907","December 22, 1998","Effingham, Kansas",1907,1998.0,1,1930.0,1931.0,1934.0,23.0,24.0,27.0
Mount St. Scholastica College,Assistant Professor,1938,1945,Promotion,Sister M. Helen Sullivan,"April 10, 1907","December 22, 1998","Effingham, Kansas",1907,1998.0,2,1930.0,1931.0,1934.0,23.0,24.0,27.0
Mount St. Scholastica College,Professor,1945,1970,Retirement,Sister M. Helen Sullivan,"April 10, 1907","December 22, 1998","Effingham, Kansas",1907,1998.0,3,1930.0,1931.0,1934.0,23.0,24.0,27.0
Mount St. Scholastica College,Professor Emeritus,1970,,,Sister M. Helen Sullivan,"April 10, 1907","December 22, 1998","Effingham, Kansas",1907,1998.0,4,1930.0,1931.0,1934.0,23.0,24.0,27.0
Loyola University New Orleans,Visiting Professor,1948,1949,End of appointment,Sister M. Helen Sullivan,"April 10, 1907","December 22, 1998","Effingham, Kansas",1907,1998.0,5,1930.0,1931.0,1934.0,23.0,24.0,27.0
Fort Smith Junior College,Visiting Professor,1953,1954,End of appointment,Sister M. Helen Sullivan,"April 10, 1907","December 22, 1998","Effingham, Kansas",1907,1998.0,6,1930.0,1931.0,1934.0,23.0,24.0,27.0
Wesleyan University,Visiting Professor,1968,1968,End of appointment,Sister M. Helen Sullivan,"April 10, 1907","December 22, 1998","Effingham, Kansas",1907,1998.0,7,1930.0,1931.0,1934.0,23.0,24.0,27.0
University of Detroit,NSF Visiting Lecturer,1960,1963,End of appointment,Sister M. Helen Sullivan,"April 10, 1907","December 22, 1998","Effingham, Kansas",1907,1998.0,8,1930.0,1931.0,1934.0,23.0,24.0,27.0
Rosary Hill College,NSF Summer Institute Instructor,1965,1965,End of appointment,Sister M. Helen Sullivan,"April 10, 1907","December 22, 1998","Effingham, Kansas",1907,1998.0,9,1930.0,1931.0,1934.0,23.0,24.0,27.0
Claflin University,NSF Summer Institute Instructor,1965,1966,End of appointment,Sister M. Helen Sullivan,"April 10, 1907","December 22, 1998","Effingham, Kansas",1907,1998.0,10,1930.0,1931.0,1934.0,23.0,24.0,27.0
University of Minnesota,Visiting Professor,1964,1965,End of sabbatical,Sister M. Helen Sullivan,"April 10, 1907","December 22, 1998","Effingham, Kansas",1907,1998.0,11,1930.0,1931.0,1934.0,23.0,24.0,27.0
College of St. Catherine,Part-time Visiting Professor,1964,1965,End of sabbatical,Sister M. Helen Sullivan,"April 10, 1907","December 22, 1998","Effingham, Kansas",1907,1998.0,12,1930.0,1931.0,1934.0,23.0,24.0,27.0
"University College, Galway",Visiting Professor,1970,1971,End of sabbatical,Sister M. Helen Sullivan,"April 10, 1907","December 22, 1998","Effingham, Kansas",1907,1998.0,13,1930.0,1931.0,1934.0,23.0,24.0,27.0
University of Vienna,"Consultant, Academic Counselor, and Tutor",1971,1972,End of appointment,Sister M. Helen Sullivan,"April 10, 1907","December 22, 1998","Effingham, Kansas",1907,1998.0,14,1930.0,1931.0,1934.0,23.0,24.0,27.0
Lillis High School,Director of Development,1972,1973,End of appointment,Sister M. Helen Sullivan,"April 10, 1907","December 22, 1998","Effingham, Kansas",1907,1998.0,15,1930.0,1931.0,1934.0,23.0,24.0,27.0
"Diocesan Office of Education in Billings, Montana",Assistant Director,1973,1975,End of appointment,Sister M. Helen Sullivan,"April 10, 1907","December 22, 1998","Effingham, Kansas",1907,1998.0,16,1930.0,1931.0,1934.0,23.0,24.0,27.0
Jesuit School of Theology,Research Assistant,1976,1977,End of appointment,Sister M. Helen Sullivan,"April 10, 1907","December 22, 1998","Effingham, Kansas",1907,1998.0,17,1930.0,1931.0,1934.0,23.0,24.0,27.0
Graduate Theological Union,Assistant to the President,1977,1978,End of appointment,Sister M. Helen Sullivan,"April 10, 1907","December 22, 1998","Effingham, Kansas",1907,1998.0,18,1930.0,1931.0,1934.0,23.0,24.0,27.0
School of Applied Theology,Assistant to the President,1978,1979,End of appointment,Sister M. Helen Sullivan,"April 10, 1907","December 22, 1998","Effingham, Kansas",1907,1998.0,19,1930.0,1931.0,1934.0,23.0,24.0,27.0
Catholic Charity Services,Development Research Specialist,1978,1981,End of appointment,Sister M. Helen Sullivan,"April 10, 1907","December 22, 1998","Effingham, Kansas",1907,1998.0,20,1930.0,1931.0,1934.0,23.0,24.0,27.0
Johnston City Township High School,Teacher,1922,1923,Moved to Knox College,Mildred Ellen Taylor,"July 25, 1898","November 3, 1978","Virginia, Illinois",1898,1978.0,1,1921.0,1922.0,1931.0,23.0,24.0,33.0
Knox College,Instructor,1923,1929,Leave of absence for PhD,Mildred Ellen Taylor,"July 25, 1898","November 3, 1978","Virginia, Illinois",1898,1978.0,2,1921.0,1922.0,1931.0,23.0,24.0,33.0
Mary Baldwin College,Professor of Mathematics and Department Head,1930,1937,Title change,Mildred Ellen Taylor,"July 25, 1898","November 3, 1978","Virginia, Illinois",1898,1978.0,3,1921.0,1922.0,1931.0,23.0,24.0,33.0
Mary Baldwin College,Professor of Mathematics and Astronomy,1937,1968,Retirement,Mildred Ellen Taylor,"July 25, 1898","November 3, 1978","Virginia, Illinois",1898,1978.0,4,1921.0,1922.0,1931.0,23.0,24.0,33.0
Northwestern University,Instructor,1927,1930,Promotion,Lois Wilfred Griffiths,"June 27, 1899","November 9, 1981","Chagrin Falls, Ohio",1899,1981.0,1,1921.0,1923.0,1927.0,22.0,24.0,28.0
Northwestern University,Assistant Professor,1930,1938,Promotion,Lois Wilfred Griffiths,"June 27, 1899","November 9, 1981","Chagrin Falls, Ohio",1899,1981.0,2,1921.0,1923.0,1927.0,22.0,24.0,28.0
Northwestern University,Associate Professor,1938,1964,Retirement,Lois Wilfred Griffiths,"June 27, 1899","November 9, 1981","Chagrin Falls, Ohio",1899,1981.0,3,1921.0,1923.0,1927.0,22.0,24.0,28.0
Northwestern University,Emeritus Associate Professor,1964,,Death,Lois Wilfred Griffiths,"June 27, 1899","November 9, 1981","Chagrin Falls, Ohio",1899,1981.0,4,1921.0,1923.0,1927.0,22.0,24.0,28.0
Norwalk High School,Mathematics Teacher,1895,1905,Left to pursue further education,Suzan Rose Benedict,"November 29, 1873","April 8, 1942","Ohio, USA",1873,1942.0,1,1895.0,1906.0,1914.0,22.0,33.0,41.0
Smith College,Assistant in Mathematics,1906,1907,Reappointed as Instructor,Suzan Rose Benedict,"November 29, 1873","April 8, 1942","Ohio, USA",1873,1942.0,2,1895.0,1906.0,1914.0,22.0,33.0,41.0
Smith College,Instructor in Mathematics,1907,1914,Promoted to Associate Professor,Suzan Rose Benedict,"November 29, 1873","April 8, 1942","Ohio, USA",1873,1942.0,3,1895.0,1906.0,1914.0,22.0,33.0,41.0
Smith College,Associate Professor,1914,1921,Promoted to Professor,Suzan Rose Benedict,"November 29, 1873","April 8, 1942","Ohio, USA",1873,1942.0,4,1895.0,1906.0,1914.0,22.0,33.0,41.0
Smith College,Professor,1921,1942,Retired,Suzan Rose Benedict,"November 29, 1873","April 8, 1942","Ohio, USA",1873,1942.0,5,1895.0,1906.0,1914.0,22.0,33.0,41.0
Smith College,Department Chairman,1928,1934,End of term,Suzan Rose Benedict,"November 29, 1873","April 8, 1942","Ohio, USA",1873,1942.0,6,1895.0,1906.0,1914.0,22.0,33.0,41.0
Smith College,Class Dean,1918,1926,End of term,Suzan Rose Benedict,"November 29, 1873","April 8, 1942","Ohio, USA",1873,1942.0,7,1895.0,1906.0,1914.0,22.0,33.0,41.0
International Statistical Bureau,Research Statistician,1938,1939,Marriage,Marion Belle Greenebaum Epstein,"June 14, 1915",,"Brooklyn, New York",1915,,1,1935.0,1936.0,1938.0,20.0,21.0,23.0
Educational Testing Service (ETS),Associate Examiner in Mathematics,1944,1948,Birth of youngest daughter,Marion Belle Greenebaum Epstein,"June 14, 1915",,"Brooklyn, New York",1915,,2,1935.0,1936.0,1938.0,20.0,21.0,23.0
Educational Testing Service (ETS),Professional Associate in Mathematics,1954,1962,Promotion,Marion Belle Greenebaum Epstein,"June 14, 1915",,"Brooklyn, New York",1915,,3,1935.0,1936.0,1938.0,20.0,21.0,23.0
Educational Testing Service (ETS),Senior Examiner in Mathematics,1962,1967,Promotion,Marion Belle Greenebaum Epstein,"June 14, 1915",,"Brooklyn, New York",1915,,4,1935.0,1936.0,1938.0,20.0,21.0,23.0
Educational Testing Service (ETS),Assistant Director of the Division,1967,1968,Promotion,Marion Belle Greenebaum Epstein,"June 14, 1915",,"Brooklyn, New York",1915,,5,1935.0,1936.0,1938.0,20.0,21.0,23.0
Educational Testing Service (ETS),Associate Director,1968,1973,Transfer,Marion Belle Greenebaum Epstein,"June 14, 1915",,"Brooklyn, New York",1915,,6,1935.0,1936.0,1938.0,20.0,21.0,23.0
Educational Testing Service (ETS),Director of Development and Analysis,1973,1975,Promotion,Marion Belle Greenebaum Epstein,"June 14, 1915",,"Brooklyn, New York",1915,,7,1935.0,1936.0,1938.0,20.0,21.0,23.0
Educational Testing Service (ETS),Administrative Director of Professional Services,1975,1977,Promotion,Marion Belle Greenebaum Epstein,"June 14, 1915",,"Brooklyn, New York",1915,,8,1935.0,1936.0,1938.0,20.0,21.0,23.0
Educational Testing Service (ETS),Vice President,1977,1980,Promotion,Marion Belle Greenebaum Epstein,"June 14, 1915",,"Brooklyn, New York",1915,,9,1935.0,1936.0,1938.0,20.0,21.0,23.0
Educational Testing Service (ETS),Senior Advisor to the Senior Vice President for Programs,1980,,,Marion Belle Greenebaum Epstein,"June 14, 1915",,"Brooklyn, New York",1915,,10,1935.0,1936.0,1938.0,20.0,21.0,23.0
University of Pittsburgh,Graduate Assistant in Mathematics,1929,1933,Moved to University of Pennsylvania for further studies,Vivian Eberle Spencer,"October 27, 1907","September 14, 1980","New Castle, Pennsylvania",1907,1980.0,1,1928.0,1929.0,1936.0,21.0,22.0,29.0
National Research Project (NRP) of the Works Progress Administration (WPA),Statistical Research Assistant,1936,1937,Moved to US Department of Commerce,Vivian Eberle Spencer,"October 27, 1907","September 14, 1980","New Castle, Pennsylvania",1907,1980.0,2,1928.0,1929.0,1936.0,21.0,22.0,29.0
US Bureau of Mines,Associate Statistician,1936,1937,Moved to US Department of Commerce,Vivian Eberle Spencer,"October 27, 1907","September 14, 1980","New Castle, Pennsylvania",1907,1980.0,3,1928.0,1929.0,1936.0,21.0,22.0,29.0
US Department of Commerce,Mineral Economist and Statistician,1940,1969,Moved to US Department of the Interior's Bureau of Mines,Vivian Eberle Spencer,"October 27, 1907","September 14, 1980","New Castle, Pennsylvania",1907,1980.0,4,1928.0,1929.0,1936.0,21.0,22.0,29.0
US Department of the Interior's Bureau of Mines,Chief of the Commodity Staff,1969,1971,Retirement,Vivian Eberle Spencer,"October 27, 1907","September 14, 1980","New Castle, Pennsylvania",1907,1980.0,5,1928.0,1929.0,1936.0,21.0,22.0,29.0
American University,Professorial Lecturer in Statistics,1957,1965,End of tenure,Vivian Eberle Spencer,"October 27, 1907","September 14, 1980","New Castle, Pennsylvania",1907,1980.0,6,1928.0,1929.0,1936.0,21.0,22.0,29.0
University of Connecticut,Adjunct Professor in Mathematics,1973,,Death,Vivian Eberle Spencer,"October 27, 1907","September 14, 1980","New Castle, Pennsylvania",1907,1980.0,7,1928.0,1929.0,1936.0,21.0,22.0,29.0
US Bureau of the Census,Consultant,1972,1978,End of consultancy,Vivian Eberle Spencer,"October 27, 1907","September 14, 1980","New Castle, Pennsylvania",1907,1980.0,8,1928.0,1929.0,1936.0,21.0,22.0,29.0
Winner High School,Teacher,1919,1920,Moved to another school,Margaret Evelyn Mauch,"June 1, 1897","November 16, 1987","De Smet, South Dakota",1897,1987.0,1,1919.0,1923.0,1938.0,22.0,26.0,41.0
Edgerton High School,Principal,1920,1921,Pursued further education,Margaret Evelyn Mauch,"June 1, 1897","November 16, 1987","De Smet, South Dakota",1897,1987.0,2,1919.0,1923.0,1938.0,22.0,26.0,41.0
Jacksonville High School,Teacher,1924,1925,Moved to another college,Margaret Evelyn Mauch,"June 1, 1897","November 16, 1987","De Smet, South Dakota",1897,1987.0,3,1919.0,1923.0,1938.0,22.0,26.0,41.0
Randolph-Macon Woman’s College,Instructor and Assistant Professor,1925,1929,Returned to University of Chicago,Margaret Evelyn Mauch,"June 1, 1897","November 16, 1987","De Smet, South Dakota",1897,1987.0,4,1919.0,1923.0,1938.0,22.0,26.0,41.0
Brookings High School,Head of Mathematics Department,1934,1942,Moved to Carleton College,Margaret Evelyn Mauch,"June 1, 1897","November 16, 1987","De Smet, South Dakota",1897,1987.0,5,1919.0,1923.0,1938.0,22.0,26.0,41.0
Carleton College,Instructor and Assistant Professor,1942,1944,Moved to Michigan State College,Margaret Evelyn Mauch,"June 1, 1897","November 16, 1987","De Smet, South Dakota",1897,1987.0,6,1919.0,1923.0,1938.0,22.0,26.0,41.0
Michigan State College,Instructor,1944,1945,Moved to University of Akron,Margaret Evelyn Mauch,"June 1, 1897","November 16, 1987","De Smet, South Dakota",1897,1987.0,7,1919.0,1923.0,1938.0,22.0,26.0,41.0
University of Akron,"Assistant Professor, Associate Professor, Professor",1945,1963,Retired,Margaret Evelyn Mauch,"June 1, 1897","November 16, 1987","De Smet, South Dakota",1897,1987.0,8,1919.0,1923.0,1938.0,22.0,26.0,41.0
High School in Minnesota,Teacher,1927,1929,Returned to university,Marian Augusta Wilder Thornton,"July 18, 1905","September 30, 1992","Shakopee, Minnesota",1905,1992.0,1,1927.0,1930.0,1933.0,22.0,25.0,28.0
University of Minnesota,Assistant in Mathematics,1929,1931,Position change,Marian Augusta Wilder Thornton,"July 18, 1905","September 30, 1992","Shakopee, Minnesota",1905,1992.0,2,1927.0,1930.0,1933.0,22.0,25.0,28.0
University of Minnesota,Assistant in Biometry,1931,1934,Position change,Marian Augusta Wilder Thornton,"July 18, 1905","September 30, 1992","Shakopee, Minnesota",1905,1992.0,3,1927.0,1930.0,1933.0,22.0,25.0,28.0
University of Minnesota,Graduate Fellow in Biometric Laboratory,1933,1934,Position change,Marian Augusta Wilder Thornton,"July 18, 1905","September 30, 1992","Shakopee, Minnesota",1905,1992.0,4,1927.0,1930.0,1933.0,22.0,25.0,28.0
Mayo Clinic,Statistician,1934,1935,Returned to university,Marian Augusta Wilder Thornton,"July 18, 1905","September 30, 1992","Shakopee, Minnesota",1905,1992.0,5,1927.0,1930.0,1933.0,22.0,25.0,28.0
University of Minnesota,Research Statistician and Instructor,1935,1936,Health issues,Marian Augusta Wilder Thornton,"July 18, 1905","September 30, 1992","Shakopee, Minnesota",1905,1992.0,6,1927.0,1930.0,1933.0,22.0,25.0,28.0
Minnesota State Department of Health,"Statistician, Division of Preventable Diseases",1938,1942,End of employment period,Marian Augusta Wilder Thornton,"July 18, 1905","September 30, 1992","Shakopee, Minnesota",1905,1992.0,7,1927.0,1930.0,1933.0,22.0,25.0,28.0
College of St. Catherine,Substitute,1954,1954,Temporary position,Marian Augusta Wilder Thornton,"July 18, 1905","September 30, 1992","Shakopee, Minnesota",1905,1992.0,8,1927.0,1930.0,1933.0,22.0,25.0,28.0
University of Minnesota,Associate Professor,1970,1971,Retirement,Marian Augusta Wilder Thornton,"July 18, 1905","September 30, 1992","Shakopee, Minnesota",1905,1992.0,9,1927.0,1930.0,1933.0,22.0,25.0,28.0
Fairmount Seminary,Teacher,1916,1917,Became statistical clerk at the Department of Agriculture,Dorothy Walcott Weeks,"May 3, 1893","June 4, 1990","Philadelphia, Pennsylvania",1893,1990.0,1,1916.0,1923.0,1930.0,23.0,30.0,37.0
US Patent Office,Patent Examiner,1917,1920,Moved to MIT,Dorothy Walcott Weeks,"May 3, 1893","June 4, 1990","Philadelphia, Pennsylvania",1893,1990.0,2,1916.0,1923.0,1930.0,23.0,30.0,37.0
Massachusetts Institute of Technology,Instructor of Physics,1920,1927,Moved to Simmons College,Dorothy Walcott Weeks,"May 3, 1893","June 4, 1990","Philadelphia, Pennsylvania",1893,1990.0,3,1916.0,1923.0,1930.0,23.0,30.0,37.0
Jordan Marsh,Hiring Supervisor,1925,1927,Temporary position at Harvard Medical School,Dorothy Walcott Weeks,"May 3, 1893","June 4, 1990","Philadelphia, Pennsylvania",1893,1990.0,4,1916.0,1923.0,1930.0,23.0,30.0,37.0
Wilson College,Professor and Head of Physics Department,1930,1956,Retired,Dorothy Walcott Weeks,"May 3, 1893","June 4, 1990","Philadelphia, Pennsylvania",1893,1990.0,5,1916.0,1923.0,1930.0,23.0,30.0,37.0
"Ordnance Materials Research Office, Army Materials Research Agency",Physicist,1956,1964,Forced to retire,Dorothy Walcott Weeks,"May 3, 1893","June 4, 1990","Philadelphia, Pennsylvania",1893,1990.0,6,1916.0,1923.0,1930.0,23.0,30.0,37.0
Harvard College Observatory,Spectroscopist,1964,1976,Final retirement,Dorothy Walcott Weeks,"May 3, 1893","June 4, 1990","Philadelphia, Pennsylvania",1893,1990.0,7,1916.0,1923.0,1930.0,23.0,30.0,37.0
Newton College of the Sacred Heart,Physics Lecturer,1966,1971,Final retirement,Dorothy Walcott Weeks,"May 3, 1893","June 4, 1990","Philadelphia, Pennsylvania",1893,1990.0,8,1916.0,1923.0,1930.0,23.0,30.0,37.0
University of Saskatchewan,Assistant in Mathematics Department,1930,1932,Completed Master's degree,Vera Adela Widder (née Ames),"December 12, 1909","May 18, 2004","Milestone, Saskatchewan, Canada",1909,2004.0,1,1931.0,1932.0,1938.0,22.0,23.0,29.0
Bryn Mawr College,Resident Fellow,1932,1934,End of fellowship,Vera Adela Widder (née Ames),"December 12, 1909","May 18, 2004","Milestone, Saskatchewan, Canada",1909,2004.0,2,1931.0,1932.0,1938.0,22.0,23.0,29.0
H. Sophie Newcomb College,Substitute Instructor,1934,1935,Temporary position,Vera Adela Widder (née Ames),"December 12, 1909","May 18, 2004","Milestone, Saskatchewan, Canada",1909,2004.0,3,1931.0,1932.0,1938.0,22.0,23.0,29.0
Baldwin School,Part-time Teacher,1935,1936,Continued graduate studies,Vera Adela Widder (née Ames),"December 12, 1909","May 18, 2004","Milestone, Saskatchewan, Canada",1909,2004.0,4,1931.0,1932.0,1938.0,22.0,23.0,29.0
Miss Fine’s School,Teacher,1936,1937,Moved to University of Saskatchewan,Vera Adela Widder (née Ames),"December 12, 1909","May 18, 2004","Milestone, Saskatchewan, Canada",1909,2004.0,5,1931.0,1932.0,1938.0,22.0,23.0,29.0
University of Saskatchewan,Instructor,1937,1939,Marriage and relocation,Vera Adela Widder (née Ames),"December 12, 1909","May 18, 2004","Milestone, Saskatchewan, Canada",1909,2004.0,6,1931.0,1932.0,1938.0,22.0,23.0,29.0
Cambridge Junior College,Instructor,1942,1944,End of contract,Vera Adela Widder (née Ames),"December 12, 1909","May 18, 2004","Milestone, Saskatchewan, Canada",1909,2004.0,7,1931.0,1932.0,1938.0,22.0,23.0,29.0
Cambridge Junior College,Instructor,1945,1947,End of contract,Vera Adela Widder (née Ames),"December 12, 1909","May 18, 2004","Milestone, Saskatchewan, Canada",1909,2004.0,8,1931.0,1932.0,1938.0,22.0,23.0,29.0
UCLA,Lecturer,1948,1949,End of contract,Vera Adela Widder (née Ames),"December 12, 1909","May 18, 2004","Milestone, Saskatchewan, Canada",1909,2004.0,9,1931.0,1932.0,1938.0,22.0,23.0,29.0
Tufts College,Lecturer,1950,1951,End of contract,Vera Adela Widder (née Ames),"December 12, 1909","May 18, 2004","Milestone, Saskatchewan, Canada",1909,2004.0,10,1931.0,1932.0,1938.0,22.0,23.0,29.0
Harvard Library,Mathematics books classifier,1929,1930,End of employment period,Ruth Gertrude Simond,"March 7, 1904","September 15, 1958","Franklin, New Hampshire",1904,1958.0,1,1927.0,1929.0,1938.0,23.0,25.0,34.0
Hampton Institute,Instructor,1930,1931,End of academic year,Ruth Gertrude Simond,"March 7, 1904","September 15, 1958","Franklin, New Hampshire",1904,1958.0,2,1927.0,1929.0,1938.0,23.0,25.0,34.0
Gorham Normal School,Teacher,1931,1932,End of academic year,Ruth Gertrude Simond,"March 7, 1904","September 15, 1958","Franklin, New Hampshire",1904,1958.0,3,1927.0,1929.0,1938.0,23.0,25.0,34.0
Hampton Institute,Instructor,1932,1933,End of academic year,Ruth Gertrude Simond,"March 7, 1904","September 15, 1958","Franklin, New Hampshire",1904,1958.0,4,1927.0,1929.0,1938.0,23.0,25.0,34.0
University of Michigan,Mathematics courses in correspondence study department,1936,1938,Completion of PhD,Ruth Gertrude Simond,"March 7, 1904","September 15, 1958","Franklin, New Hampshire",1904,1958.0,5,1927.0,1929.0,1938.0,23.0,25.0,34.0
Hampton Institute,Associate Professor,1938,1942,Left for U.S. Navy Department,Ruth Gertrude Simond,"March 7, 1904","September 15, 1958","Franklin, New Hampshire",1904,1958.0,6,1927.0,1929.0,1938.0,23.0,25.0,34.0
U.S. Navy Department,Cryptanalyst,1942,1943,End of World War II duties,Ruth Gertrude Simond,"March 7, 1904","September 15, 1958","Franklin, New Hampshire",1904,1958.0,7,1927.0,1929.0,1938.0,23.0,25.0,34.0
Heidelberg College,Army Specialized Training Program Instructor,1943,1944,End of program,Ruth Gertrude Simond,"March 7, 1904","September 15, 1958","Franklin, New Hampshire",1904,1958.0,8,1927.0,1929.0,1938.0,23.0,25.0,34.0
Berea College,Assistant Professor,1945,1947,End of employment period,Ruth Gertrude Simond,"March 7, 1904","September 15, 1958","Franklin, New Hampshire",1904,1958.0,9,1927.0,1929.0,1938.0,23.0,25.0,34.0
Morningside College,Assistant Professor,1947,1948,End of academic year,Ruth Gertrude Simond,"March 7, 1904","September 15, 1958","Franklin, New Hampshire",1904,1958.0,10,1927.0,1929.0,1938.0,23.0,25.0,34.0
University of Vermont and State Agricultural College,Assistant Professor,1948,1958,Death,Ruth Gertrude Simond,"March 7, 1904","September 15, 1958","Franklin, New Hampshire",1904,1958.0,11,1927.0,1929.0,1938.0,23.0,25.0,34.0
Bryn Mawr School,Mathematics Teacher,1935,1936,Moved to teach at Miss Fine’s School,Ruth Caroline McKee (Stauffer),"July 16, 1910","January 9, 1993","Harrisburg, Pennsylvania",1910,1993.0,1,1931.0,1933.0,1935.0,21.0,23.0,25.0
Miss Fine’s School,Mathematics Teacher,1936,1937,Marriage and relocation,Ruth Caroline McKee (Stauffer),"July 16, 1910","January 9, 1993","Harrisburg, Pennsylvania",1910,1993.0,2,1931.0,1933.0,1935.0,21.0,23.0,25.0
Bryn Mawr College,Algebra Instructor,1938,1939,Pregnancy and illness,Ruth Caroline McKee (Stauffer),"July 16, 1910","January 9, 1993","Harrisburg, Pennsylvania",1910,1993.0,3,1931.0,1933.0,1935.0,21.0,23.0,25.0
Joint State Government Commission,Analyst,1953,1980,Retirement,Ruth Caroline McKee (Stauffer),"July 16, 1910","January 9, 1993","Harrisburg, Pennsylvania",1910,1993.0,4,1931.0,1933.0,1935.0,21.0,23.0,25.0
"Bryn Mawr School, Baltimore",Teacher of Mathematics and Science,1898,1901,Returned to graduate studies,Virginia Ragsdale,"December 13, 1870","June 4, 1945","Jamestown, North Carolina",1870,1945.0,1,1892.0,,1904.0,22.0,,34.0
