employer,job_title,job_year_begin,job_year_end,reason_end,full_name,birthdate,deathdate,birthplace,birthyear,deathyear,nth_job,bachelors_year,masters_year,phd_year,bachelors_age,masters_age,phd_age
University of Maryland,Instructor of extension courses,1960,1965,Not specified,Virginia Modesitt Reklis,"June 15, 1910","November 29, 2000","Bloomington, Indiana",1910,2000.0,4,1931.0,1932.0,1937.0,21.0,22.0,27.0
University of Delaware,Instructor of extension courses,1962,1966,Not specified,Virginia Modesitt Reklis,"June 15, 1910","November 29, 2000","Bloomington, Indiana",1910,2000.0,5,1931.0,1932.0,1937.0,21.0,22.0,27.0
Binghamton Central High School,Teacher,1894,1898,Left to pursue further studies,Anna Lavinia Van Benschoten,"August 12, 1866","September 18, 1927","Elmira, New York",1866,1927.0,1,1894.0,1900.0,1908.0,28.0,34.0,42.0
Wells College,Professor,1901,1920,Retired due to ill health,Anna Lavinia Van Benschoten,"August 12, 1866","September 18, 1927","Elmira, New York",1866,1927.0,2,1894.0,1900.0,1908.0,28.0,34.0,42.0
University of Arizona,Mathematics Teacher,1918,1918,Temporary position,Anna Lavinia Van Benschoten,"August 12, 1866","September 18, 1927","Elmira, New York",1866,1927.0,3,1894.0,1900.0,1908.0,28.0,34.0,42.0
Whittier College,Temporary Faculty Member,1924,1924,Temporary replacement,Anna Lavinia Van Benschoten,"August 12, 1866","September 18, 1927","Elmira, New York",1866,1927.0,4,1894.0,1900.0,1908.0,28.0,34.0,42.0
Tosten High School,High School Teacher,1930,1932,Moved to graduate studies,Andrewa Rebecca Noble,"March 28, 1908","November 21, 1993","Oregon City, Oregon",1908,1993.0,1,1929.0,1934.0,1935.0,21.0,26.0,27.0
Colstrip Schools,Teacher,1935,1936,Promoted to superintendent,Andrewa Rebecca Noble,"March 28, 1908","November 21, 1993","Oregon City, Oregon",1908,1993.0,2,1929.0,1934.0,1935.0,21.0,26.0,27.0
Colstrip Schools,Superintendent of Schools,1936,1937,Moved to Washington,Andrewa Rebecca Noble,"March 28, 1908","November 21, 1993","Oregon City, Oregon",1908,1993.0,3,1929.0,1934.0,1935.0,21.0,26.0,27.0
Washington State High School,High School Teacher,1937,1938,Moved to San Francisco Junior College,Andrewa Rebecca Noble,"March 28, 1908","November 21, 1993","Oregon City, Oregon",1908,1993.0,4,1929.0,1934.0,1935.0,21.0,26.0,27.0
San Francisco Junior College,Instructor,1940,1945,Moved to Montana State University,Andrewa Rebecca Noble,"March 28, 1908","November 21, 1993","Oregon City, Oregon",1908,1993.0,5,1929.0,1934.0,1935.0,21.0,26.0,27.0
Montana State University,Assistant Professor,1946,1947,Returned to Pacific University,Andrewa Rebecca Noble,"March 28, 1908","November 21, 1993","Oregon City, Oregon",1908,1993.0,6,1929.0,1934.0,1935.0,21.0,26.0,27.0
Pacific University,Associate Professor and Secretary of the Faculty,1947,1949,Moved to Mills College,Andrewa Rebecca Noble,"March 28, 1908","November 21, 1993","Oregon City, Oregon",1908,1993.0,7,1929.0,1934.0,1935.0,21.0,26.0,27.0
Mills College,"Assistant Professor of Mathematics and Physics, Department Head",1952,1957,Moved to Chico State College,Andrewa Rebecca Noble,"March 28, 1908","November 21, 1993","Oregon City, Oregon",1908,1993.0,8,1929.0,1934.0,1935.0,21.0,26.0,27.0
Chico State College,Assistant Professor,1957,1959,Returned to Pacific University,Andrewa Rebecca Noble,"March 28, 1908","November 21, 1993","Oregon City, Oregon",1908,1993.0,9,1929.0,1934.0,1935.0,21.0,26.0,27.0
Pacific University,"Associate Professor, later Professor and Department Chair",1959,1965,Retired,Andrewa Rebecca Noble,"March 28, 1908","November 21, 1993","Oregon City, Oregon",1908,1993.0,10,1929.0,1934.0,1935.0,21.0,26.0,27.0
"Bryn Mawr School, Baltimore",Teacher of Latin,1895,1895,Resumed studies,Emilie Norton Martin,"December 30, 1869","February 8, 1936","Elizabeth, New Jersey",1869,1936.0,1,1894.0,,1901.0,25.0,,32.0
"Misses Kirk’s School, Rosemont, Pennsylvania",Teacher of Mathematics,1899,1900,,Emilie Norton Martin,"December 30, 1869","February 8, 1936","Elizabeth, New Jersey",1869,1936.0,2,1894.0,,1901.0,25.0,,32.0
Mount Holyoke College,Instructor,1903,1911,Promoted to Associate Professor,Emilie Norton Martin,"December 30, 1869","February 8, 1936","Elizabeth, New Jersey",1869,1936.0,3,1894.0,,1901.0,25.0,,32.0
Mount Holyoke College,Associate Professor,1911,1925,Promoted to Professor,Emilie Norton Martin,"December 30, 1869","February 8, 1936","Elizabeth, New Jersey",1869,1936.0,4,1894.0,,1901.0,25.0,,32.0
Mount Holyoke College,Professor,1925,1935,Resigned,Emilie Norton Martin,"December 30, 1869","February 8, 1936","Elizabeth, New Jersey",1869,1936.0,5,1894.0,,1901.0,25.0,,32.0
Mount Holyoke College,Department Chairman,1927,1935,Resigned,Emilie Norton Martin,"December 30, 1869","February 8, 1936","Elizabeth, New Jersey",1869,1936.0,6,1894.0,,1901.0,25.0,,32.0
Watertown High School,Teacher of mathematics and Latin,1906,1907,,Eugenie Maria Morenus,"February 21, 1881","October 15, 1966","Cleveland, New York",1881,1966.0,1,1904.0,1905.0,1922.0,23.0,24.0,41.0
Vassar College,Substitute in mathematics,1907,1908,,Eugenie Maria Morenus,"February 21, 1881","October 15, 1966","Cleveland, New York",1881,1966.0,2,1904.0,1905.0,1922.0,23.0,24.0,41.0
Poughkeepsie High School,Teacher of mathematics,1908,1909,,Eugenie Maria Morenus,"February 21, 1881","October 15, 1966","Cleveland, New York",1881,1966.0,3,1904.0,1905.0,1922.0,23.0,24.0,41.0
Sweet Briar College,Instructor in mathematics and Latin,1909,1916,Promotion,Eugenie Maria Morenus,"February 21, 1881","October 15, 1966","Cleveland, New York",1881,1966.0,4,1904.0,1905.0,1922.0,23.0,24.0,41.0
Sweet Briar College,Associate professor of mathematics,1916,1918,Promotion,Eugenie Maria Morenus,"February 21, 1881","October 15, 1966","Cleveland, New York",1881,1966.0,5,1904.0,1905.0,1922.0,23.0,24.0,41.0
Sweet Briar College,Professor of mathematics and head of the department,1918,1946,Retirement,Eugenie Maria Morenus,"February 21, 1881","October 15, 1966","Cleveland, New York",1881,1966.0,6,1904.0,1905.0,1922.0,23.0,24.0,41.0
Connecticut College,Teacher,1947,1947,,Eugenie Maria Morenus,"February 21, 1881","October 15, 1966","Cleveland, New York",1881,1966.0,7,1904.0,1905.0,1922.0,23.0,24.0,41.0
Mrs. Sylvanus Reed’s Boarding and Day School for Young Ladies,Teacher,1884,1887,Marriage,Winifred Haring Edgerton Merrill,"September 24, 1862","September 6, 1951","Ripon, Wisconsin",1862,1951.0,1,1883.0,,1886.0,21.0,,24.0
Emma Willard School,Teacher,1894,1895,End of employment period,Winifred Haring Edgerton Merrill,"September 24, 1862","September 6, 1951","Ripon, Wisconsin",1862,1951.0,2,1883.0,,1886.0,21.0,,24.0
Highcliff Hall,Head of Mathematics Department,1904,1906,Founded Oaksmere School,Winifred Haring Edgerton Merrill,"September 24, 1862","September 6, 1951","Ripon, Wisconsin",1862,1951.0,3,1883.0,,1886.0,21.0,,24.0
Oaksmere School for Girls,Principal,1906,1928,Closed the school,Winifred Haring Edgerton Merrill,"September 24, 1862","September 6, 1951","Ripon, Wisconsin",1862,1951.0,4,1883.0,,1886.0,21.0,,24.0
The Barbizon,Director of the Three Arts Wing,1928,,End of employment period,Winifred Haring Edgerton Merrill,"September 24, 1862","September 6, 1951","Ripon, Wisconsin",1862,1951.0,5,1883.0,,1886.0,21.0,,24.0
"Girls' school in Hollidaysburg, Pennsylvania",Teacher,1869,1871,"Accepted a position at a seminary in Washington, Pennsylvania",Christine Ladd-Franklin,"December 1, 1847","March 5, 1930","Windsor, Connecticut",1847,1930.0,1,1869.0,,1926.0,22.0,,79.0
"Seminary in Washington, Pennsylvania",Teacher,1871,1873,"Moved to Boston, Massachusetts",Christine Ladd-Franklin,"December 1, 1847","March 5, 1930","Windsor, Connecticut",1847,1930.0,2,1869.0,,1926.0,22.0,,79.0
Chelsea High School,Teacher,1873,1875,"Moved to Union Springs, New York",Christine Ladd-Franklin,"December 1, 1847","March 5, 1930","Windsor, Connecticut",1847,1930.0,3,1869.0,,1926.0,22.0,,79.0
"Howland School, Union Springs, New York",Professor of Natural Sciences and Chemistry,1875,1878,Moved to study at Johns Hopkins University,Christine Ladd-Franklin,"December 1, 1847","March 5, 1930","Windsor, Connecticut",1847,1930.0,4,1869.0,,1926.0,22.0,,79.0
Miss Randolph’s school,Teacher,1887,1887,No private pupils at present,Christine Ladd-Franklin,"December 1, 1847","March 5, 1930","Windsor, Connecticut",1847,1930.0,5,1869.0,,1926.0,22.0,,79.0
Johns Hopkins University,Part-time Lecturer in Logic and Psychology,1904,1909,Moved to New York,Christine Ladd-Franklin,"December 1, 1847","March 5, 1930","Windsor, Connecticut",1847,1930.0,6,1869.0,,1926.0,22.0,,79.0
Columbia University,Unpaid Part-time Lecturer in Logic and Psychology,1909,,,Christine Ladd-Franklin,"December 1, 1847","March 5, 1930","Windsor, Connecticut",1847,1930.0,7,1869.0,,1926.0,22.0,,79.0
"High School in Grandview, Texas",Teacher,1908,1909,Moved to Smith College,Goldie Printis Horton Porter,"September 4, 1887","May 11, 1972","Athens, Texas",1887,1972.0,1,1908.0,1910.0,1916.0,21.0,23.0,29.0
"High School in Amarillo, Texas",Teacher,1910,1912,Continued studies at Bryn Mawr College,Goldie Printis Horton Porter,"September 4, 1887","May 11, 1972","Athens, Texas",1887,1972.0,2,1908.0,1910.0,1916.0,21.0,23.0,29.0
University of Texas,Tutor,1913,1917,Promoted to instructor,Goldie Printis Horton Porter,"September 4, 1887","May 11, 1972","Athens, Texas",1887,1972.0,3,1908.0,1910.0,1916.0,21.0,23.0,29.0
University of Texas,Instructor in Pure Mathematics,1917,1926,Promoted to adjunct professor,Goldie Printis Horton Porter,"September 4, 1887","May 11, 1972","Athens, Texas",1887,1972.0,4,1908.0,1910.0,1916.0,21.0,23.0,29.0
University of Texas,Adjunct Professor,1926,1935,Promoted to assistant professor,Goldie Printis Horton Porter,"September 4, 1887","May 11, 1972","Athens, Texas",1887,1972.0,5,1908.0,1910.0,1916.0,21.0,23.0,29.0
University of Texas,Assistant Professor,1935,1958,Went on modified service,Goldie Printis Horton Porter,"September 4, 1887","May 11, 1972","Athens, Texas",1887,1972.0,6,1908.0,1910.0,1916.0,21.0,23.0,29.0
University of Texas,Assistant Professor (part-time),1958,1966,Retirement,Goldie Printis Horton Porter,"September 4, 1887","May 11, 1972","Athens, Texas",1887,1972.0,7,1908.0,1910.0,1916.0,21.0,23.0,29.0
University of Colorado,Instructor,1913,1922,Promotion,Claribel Kendall,"January 23, 1889","April 17, 1965","Denver, Colorado",1889,1965.0,1,1912.0,1914.0,1921.0,23.0,25.0,32.0
University of Colorado,Assistant Professor,1922,1928,Promotion,Claribel Kendall,"January 23, 1889","April 17, 1965","Denver, Colorado",1889,1965.0,2,1912.0,1914.0,1921.0,23.0,25.0,32.0
University of Colorado,Associate Professor,1928,1943,Promotion,Claribel Kendall,"January 23, 1889","April 17, 1965","Denver, Colorado",1889,1965.0,3,1912.0,1914.0,1921.0,23.0,25.0,32.0
University of Colorado,Professor,1943,1957,Retirement,Claribel Kendall,"January 23, 1889","April 17, 1965","Denver, Colorado",1889,1965.0,4,1912.0,1914.0,1921.0,23.0,25.0,32.0
University of California,Summer Instructor,1925,1925,End of Summer Term,Claribel Kendall,"January 23, 1889","April 17, 1965","Denver, Colorado",1889,1965.0,5,1912.0,1914.0,1921.0,23.0,25.0,32.0
"High Schools in Lyons, LeMars, and Ames, Iowa",Teacher,1909,1914,,Fay Farnum,"August 24, 1888","March 11, 1977","Spencer, Iowa",1888,1977.0,1,1909.0,1915.0,1926.0,21.0,27.0,38.0
Iowa State College,Instructor,1915,1924,,Fay Farnum,"August 24, 1888","March 11, 1977","Spencer, Iowa",1888,1977.0,2,1909.0,1915.0,1926.0,21.0,27.0,38.0
"Washington Square College, New York University",Instructor,1926,1928,Promoted to Assistant Professor,Fay Farnum,"August 24, 1888","March 11, 1977","Spencer, Iowa",1888,1977.0,3,1909.0,1915.0,1926.0,21.0,27.0,38.0
"Washington Square College, New York University",Assistant Professor,1928,1940,Leave of absence,Fay Farnum,"August 24, 1888","March 11, 1977","Spencer, Iowa",1888,1977.0,4,1909.0,1915.0,1926.0,21.0,27.0,38.0
Iowa State College,Assistant Professor,1943,1949,Retirement,Fay Farnum,"August 24, 1888","March 11, 1977","Spencer, Iowa",1888,1977.0,5,1909.0,1915.0,1926.0,21.0,27.0,38.0
Iowa State College,Assistant Professor,1955,1957,,Fay Farnum,"August 24, 1888","March 11, 1977","Spencer, Iowa",1888,1977.0,6,1909.0,1915.0,1926.0,21.0,27.0,38.0
University of Arizona,Assistant Professor,1957,,,Fay Farnum,"August 24, 1888","March 11, 1977","Spencer, Iowa",1888,1977.0,7,1909.0,1915.0,1926.0,21.0,27.0,38.0
"High School in Gravity, Iowa",Teacher,1916,1917,Moved to another school,Dora McFarland,"April 18, 1895","November 26, 1987","near Aledo, Illinois",1895,1987.0,1,1916.0,1921.0,1936.0,21.0,26.0,41.0
"High School in Aledo, Illinois",Teacher,1917,1919,Moved to another school,Dora McFarland,"April 18, 1895","November 26, 1987","near Aledo, Illinois",1895,1987.0,2,1916.0,1921.0,1936.0,21.0,26.0,41.0
"High School in Sterling, Illinois",Teacher,1919,1920,Moved to University of Oklahoma,Dora McFarland,"April 18, 1895","November 26, 1987","near Aledo, Illinois",1895,1987.0,3,1916.0,1921.0,1936.0,21.0,26.0,41.0
University of Oklahoma,Instructor,1921,1927,Promotion,Dora McFarland,"April 18, 1895","November 26, 1987","near Aledo, Illinois",1895,1987.0,4,1916.0,1921.0,1936.0,21.0,26.0,41.0
University of Oklahoma,Assistant Professor,1927,1939,Promotion,Dora McFarland,"April 18, 1895","November 26, 1987","near Aledo, Illinois",1895,1987.0,5,1916.0,1921.0,1936.0,21.0,26.0,41.0
University of Oklahoma,Associate Professor,1939,1948,Promotion,Dora McFarland,"April 18, 1895","November 26, 1987","near Aledo, Illinois",1895,1987.0,6,1916.0,1921.0,1936.0,21.0,26.0,41.0
University of Oklahoma,Professor,1948,1965,Retirement,Dora McFarland,"April 18, 1895","November 26, 1987","near Aledo, Illinois",1895,1987.0,7,1916.0,1921.0,1936.0,21.0,26.0,41.0
University of Oklahoma,Emeritus Professor,1965,,,Dora McFarland,"April 18, 1895","November 26, 1987","near Aledo, Illinois",1895,1987.0,8,1916.0,1921.0,1936.0,21.0,26.0,41.0
Hunter High School,Assistant Teacher,1925,,,Mina Spiegel Rees,"August 2, 1902","October 25, 1997","Cleveland, Ohio",1902,1997.0,1,1923.0,1925.0,1931.0,21.0,23.0,29.0
Hunter College,Instructor of Mathematics,1925,1932,Promoted to Assistant Professor,Mina Spiegel Rees,"August 2, 1902","October 25, 1997","Cleveland, Ohio",1902,1997.0,2,1923.0,1925.0,1931.0,21.0,23.0,29.0
Hunter College,Assistant Professor,1932,1940,Promoted to Associate Professor,Mina Spiegel Rees,"August 2, 1902","October 25, 1997","Cleveland, Ohio",1902,1997.0,3,1923.0,1925.0,1931.0,21.0,23.0,29.0
Hunter College,Associate Professor,1940,1943,Leave of absence for Applied Mathematics Panel,Mina Spiegel Rees,"August 2, 1902","October 25, 1997","Cleveland, Ohio",1902,1997.0,4,1923.0,1925.0,1931.0,21.0,23.0,29.0
"Applied Mathematics Panel, National Defense Research Committee",Technical Aide and Executive Assistant,1943,1946,Moved to Office of Naval Research,Mina Spiegel Rees,"August 2, 1902","October 25, 1997","Cleveland, Ohio",1902,1997.0,5,1923.0,1925.0,1931.0,21.0,23.0,29.0
Office of Naval Research,Head of Mathematics Branch,1946,1949,Promoted to Director of Mathematical Sciences Division,Mina Spiegel Rees,"August 2, 1902","October 25, 1997","Cleveland, Ohio",1902,1997.0,6,1923.0,1925.0,1931.0,21.0,23.0,29.0
Office of Naval Research,Director of Mathematical Sciences Division,1949,1952,Promoted to Deputy Science Director,Mina Spiegel Rees,"August 2, 1902","October 25, 1997","Cleveland, Ohio",1902,1997.0,7,1923.0,1925.0,1931.0,21.0,23.0,29.0
Office of Naval Research,Deputy Science Director,1952,1953,Returned to Hunter College,Mina Spiegel Rees,"August 2, 1902","October 25, 1997","Cleveland, Ohio",1902,1997.0,8,1923.0,1925.0,1931.0,21.0,23.0,29.0
Hunter College,Professor of Mathematics and Dean of the Faculty,1953,1961,City University of New York founded,Mina Spiegel Rees,"August 2, 1902","October 25, 1997","Cleveland, Ohio",1902,1997.0,9,1923.0,1925.0,1931.0,21.0,23.0,29.0
City University of New York,Professor and Dean of Graduate Studies,1961,1968,Promoted to Provost of Graduate Division,Mina Spiegel Rees,"August 2, 1902","October 25, 1997","Cleveland, Ohio",1902,1997.0,10,1923.0,1925.0,1931.0,21.0,23.0,29.0
City University of New York,Provost of Graduate Division,1968,1969,Promoted to President of the Graduate School,Mina Spiegel Rees,"August 2, 1902","October 25, 1997","Cleveland, Ohio",1902,1997.0,11,1923.0,1925.0,1931.0,21.0,23.0,29.0
City University of New York,President of the Graduate School,1969,1972,Retirement,Mina Spiegel Rees,"August 2, 1902","October 25, 1997","Cleveland, Ohio",1902,1997.0,12,1923.0,1925.0,1931.0,21.0,23.0,29.0
Vassar College,Instructor,1938,1942,Left for Institute for Advanced Study,Elizabeth Audrey Wishard McMillan,"July 7, 1914","January 10, 2008","Jubbulpore, India",1914,2008.0,1,1935.0,1936.0,1938.0,21.0,22.0,24.0
Institute for Advanced Study,Member of the School of Mathematics and Assistant to Hermann Weyl,1942,1943,"Moved to Dahlgren, Virginia",Elizabeth Audrey Wishard McMillan,"July 7, 1914","January 10, 2008","Jubbulpore, India",1914,2008.0,2,1935.0,1936.0,1938.0,21.0,22.0,24.0
US Naval Proving Ground,Associate in Mathematics,1943,1945,End of World War II,Elizabeth Audrey Wishard McMillan,"July 7, 1914","January 10, 2008","Jubbulpore, India",1914,2008.0,3,1935.0,1936.0,1938.0,21.0,22.0,24.0
Georgetown Day School,Instructor,1961,1965,Relocation,Elizabeth Audrey Wishard McMillan,"July 7, 1914","January 10, 2008","Jubbulpore, India",1914,2008.0,4,1935.0,1936.0,1938.0,21.0,22.0,24.0
New York University,Instructor,1967,1967,End of summer course,Elizabeth Audrey Wishard McMillan,"July 7, 1914","January 10, 2008","Jubbulpore, India",1914,2008.0,5,1935.0,1936.0,1938.0,21.0,22.0,24.0
"Summit, New Jersey, Board of Education",Consultant,1966,1976,End of consulting period,Elizabeth Audrey Wishard McMillan,"July 7, 1914","January 10, 2008","Jubbulpore, India",1914,2008.0,6,1935.0,1936.0,1938.0,21.0,22.0,24.0
Public Schools of Los Angeles,Teacher,1923,1924,,May Margaret Beenken,"October 22, 1901","December 21, 1988","Philadelphia, Pennsylvania",1901,1988.0,1,1923.0,1926.0,1928.0,22.0,25.0,27.0
"University of California, Southern Branch",Associate in Mathematics,1924,1925,,May Margaret Beenken,"October 22, 1901","December 21, 1988","Philadelphia, Pennsylvania",1901,1988.0,2,1923.0,1926.0,1928.0,22.0,25.0,27.0
Oshkosh Teachers College,Head of Mathematics Department,1928,1947,Left the state,May Margaret Beenken,"October 22, 1901","December 21, 1988","Philadelphia, Pennsylvania",1901,1988.0,3,1923.0,1926.0,1928.0,22.0,25.0,27.0
UCLA,Lecturer,1945,1945,,May Margaret Beenken,"October 22, 1901","December 21, 1988","Philadelphia, Pennsylvania",1901,1988.0,4,1923.0,1926.0,1928.0,22.0,25.0,27.0
Immaculate Heart College,Associate Professor of Mathematics and Department Chairman,1947,1951,Promoted to Professor,May Margaret Beenken,"October 22, 1901","December 21, 1988","Philadelphia, Pennsylvania",1901,1988.0,5,1923.0,1926.0,1928.0,22.0,25.0,27.0
Immaculate Heart College,Professor,1951,1969,Retired,May Margaret Beenken,"October 22, 1901","December 21, 1988","Philadelphia, Pennsylvania",1901,1988.0,6,1923.0,1926.0,1928.0,22.0,25.0,27.0
Goucher College,Assistant in Physics,1913,1914,Moved to Salem College,Helen Barton,"August 9, 1891","March 19, 1971","Baltimore, Maryland",1891,1971.0,1,1913.0,1922.0,1926.0,22.0,31.0,35.0
Salem College,Head of the Department of Chemistry and Physics,1915,1919,Moved to Wellesley College,Helen Barton,"August 9, 1891","March 19, 1971","Baltimore, Maryland",1891,1971.0,2,1913.0,1922.0,1926.0,22.0,31.0,35.0
Wellesley College,Instructor in Mathematics,1919,1921,Moved to Albion College,Helen Barton,"August 9, 1891","March 19, 1971","Baltimore, Maryland",1891,1971.0,3,1913.0,1922.0,1926.0,22.0,31.0,35.0
Albion College,Associate Professor of Mathematics and Dean of Women,1921,1925,Resumed full-time graduate work,Helen Barton,"August 9, 1891","March 19, 1971","Baltimore, Maryland",1891,1971.0,4,1913.0,1922.0,1926.0,22.0,31.0,35.0
Alabama College,Professor and Head of the Department,1926,1927,Moved to North Carolina College for Women,Helen Barton,"August 9, 1891","March 19, 1971","Baltimore, Maryland",1891,1971.0,5,1913.0,1922.0,1926.0,22.0,31.0,35.0
North Carolina College for Women,Professor and Head of the Department,1927,1960,Retirement,Helen Barton,"August 9, 1891","March 19, 1971","Baltimore, Maryland",1891,1971.0,6,1913.0,1922.0,1926.0,22.0,31.0,35.0
University of Buffalo,Graduate Assistant in Mathematics,1927,1929,Promoted to Instructor,Harriet Frances Montague,"June 9, 1905","March 19, 1997","Buffalo, New York",1905,1997.0,1,1927.0,1929.0,1935.0,22.0,24.0,30.0
University of Buffalo,Instructor,1929,1939,Promoted to Assistant Professor,Harriet Frances Montague,"June 9, 1905","March 19, 1997","Buffalo, New York",1905,1997.0,2,1927.0,1929.0,1935.0,22.0,24.0,30.0
University of Buffalo,Assistant Professor,1939,1944,Promoted to Associate Professor,Harriet Frances Montague,"June 9, 1905","March 19, 1997","Buffalo, New York",1905,1997.0,3,1927.0,1929.0,1935.0,22.0,24.0,30.0
University of Buffalo,Associate Professor,1944,1947,Promoted to Professor,Harriet Frances Montague,"June 9, 1905","March 19, 1997","Buffalo, New York",1905,1997.0,4,1927.0,1929.0,1935.0,22.0,24.0,30.0
University of Buffalo,Professor,1947,1973,Retired,Harriet Frances Montague,"June 9, 1905","March 19, 1997","Buffalo, New York",1905,1997.0,5,1927.0,1929.0,1935.0,22.0,24.0,30.0
University of Buffalo,Professor of Education,1967,1973,Retired,Harriet Frances Montague,"June 9, 1905","March 19, 1997","Buffalo, New York",1905,1997.0,6,1927.0,1929.0,1935.0,22.0,24.0,30.0
"Grade School in Denmark, South Carolina",Teacher,1911,1912,,Ruth Wyckliffe Stokes,"October 12, 1890","August 27, 1968","Greenville, South Carolina",1890,1968.0,1,1911.0,1923.0,1931.0,21.0,33.0,41.0
"High School in Denmark, South Carolina","Teacher of Mathematics, English, and French",1912,1913,,Ruth Wyckliffe Stokes,"October 12, 1890","August 27, 1968","Greenville, South Carolina",1890,1968.0,2,1911.0,1923.0,1931.0,21.0,33.0,41.0
"Ebenezer Graded School in Rock Hill, South Carolina",Principal,1913,1916,,Ruth Wyckliffe Stokes,"October 12, 1890","August 27, 1968","Greenville, South Carolina",1890,1968.0,3,1911.0,1923.0,1931.0,21.0,33.0,41.0
"Synodical College in Fulton, Missouri",Head of Mathematics Department,1916,1917,,Ruth Wyckliffe Stokes,"October 12, 1890","August 27, 1968","Greenville, South Carolina",1890,1968.0,4,1911.0,1923.0,1931.0,21.0,33.0,41.0
"High School in Spartanburg, South Carolina",Teacher of Mathematics and English,1917,1920,,Ruth Wyckliffe Stokes,"October 12, 1890","August 27, 1968","Greenville, South Carolina",1890,1968.0,5,1911.0,1923.0,1931.0,21.0,33.0,41.0
"High School in Greenville, South Carolina",Teacher of Mathematics,1920,1922,,Ruth Wyckliffe Stokes,"October 12, 1890","August 27, 1968","Greenville, South Carolina",1890,1968.0,6,1911.0,1923.0,1931.0,21.0,33.0,41.0
Winthrop College,Assistant Professor,1923,1928,Enrolled at Duke University,Ruth Wyckliffe Stokes,"October 12, 1890","August 27, 1968","Greenville, South Carolina",1890,1968.0,7,1911.0,1923.0,1931.0,21.0,33.0,41.0
Duke University,Instructor,1931,1932,,Ruth Wyckliffe Stokes,"October 12, 1890","August 27, 1968","Greenville, South Carolina",1890,1968.0,8,1911.0,1923.0,1931.0,21.0,33.0,41.0
North Texas State Teachers College,Associate Professor,1932,1935,,Ruth Wyckliffe Stokes,"October 12, 1890","August 27, 1968","Greenville, South Carolina",1890,1968.0,9,1911.0,1923.0,1931.0,21.0,33.0,41.0
Mitchell College,Professor and Head of Department,1935,1936,,Ruth Wyckliffe Stokes,"October 12, 1890","August 27, 1968","Greenville, South Carolina",1890,1968.0,10,1911.0,1923.0,1931.0,21.0,33.0,41.0
Asheville Normal and Teachers College,Summer Instructor,1936,1936,,Ruth Wyckliffe Stokes,"October 12, 1890","August 27, 1968","Greenville, South Carolina",1890,1968.0,11,1911.0,1923.0,1931.0,21.0,33.0,41.0
Winthrop College,"Professor of Astronomy and Mathematics, Department Head",1936,1946,Disputes with administration,Ruth Wyckliffe Stokes,"October 12, 1890","August 27, 1968","Greenville, South Carolina",1890,1968.0,12,1911.0,1923.0,1931.0,21.0,33.0,41.0
Syracuse University,Assistant Professor,1946,1953,,Ruth Wyckliffe Stokes,"October 12, 1890","August 27, 1968","Greenville, South Carolina",1890,1968.0,13,1911.0,1923.0,1931.0,21.0,33.0,41.0
Syracuse University,Associate Professor,1953,1959,Retirement,Ruth Wyckliffe Stokes,"October 12, 1890","August 27, 1968","Greenville, South Carolina",1890,1968.0,14,1911.0,1923.0,1931.0,21.0,33.0,41.0
Longwood College,Associate Professor,1959,1960,,Ruth Wyckliffe Stokes,"October 12, 1890","August 27, 1968","Greenville, South Carolina",1890,1968.0,15,1911.0,1923.0,1931.0,21.0,33.0,41.0
Emma Willard School,Teacher,1908,1909,Left for another position,Euphemia Richardson Worthington,"December 22, 1881","August 30, 1969","Troy, New York",1881,1969.0,1,1904.0,,1908.0,23.0,,27.0
Wellesley College,Instructor,1909,1918,Left to do war work,Euphemia Richardson Worthington,"December 22, 1881","August 30, 1969","Troy, New York",1881,1969.0,2,1904.0,,1908.0,23.0,,27.0
Gallaudet Aircraft Corporation,Assistant to the chief engineer,1918,1919,Unemployed,Euphemia Richardson Worthington,"December 22, 1881","August 30, 1969","Troy, New York",1881,1969.0,3,1904.0,,1908.0,23.0,,27.0
Gallaudet Aircraft Corporation,Assistant to the chief engineer,1920,1922,Appointed instructor at University of California,Euphemia Richardson Worthington,"December 22, 1881","August 30, 1969","Troy, New York",1881,1969.0,4,1904.0,,1908.0,23.0,,27.0
"University of California, Southern Branch",Instructor in mathematics,1922,1925,Promoted to assistant professor,Euphemia Richardson Worthington,"December 22, 1881","August 30, 1969","Troy, New York",1881,1969.0,5,1904.0,,1908.0,23.0,,27.0
"University of California, Los Angeles",Assistant Professor,1925,1949,Retirement,Euphemia Richardson Worthington,"December 22, 1881","August 30, 1969","Troy, New York",1881,1969.0,6,1904.0,,1908.0,23.0,,27.0
